{"attested_closure_sha256":"edc3fd15b098721a66b98760cf53a5ca3a1e88fd420204a1692a63c32154aecc","closure_sha256":"7b52f1c29fc1d84652359bacca06e919d8e00e3c104f68f68904c2a0fccdc87f","code_resource_authorization_sha256":"c0a12d1a4cae0105dadfc477c9e9111a81361b087cea52cfd5de735b53150344","config_contract_sha256":"e4d041df8b43c844b7b745fc3213454aec4ab4f41ffbdcc86483303c296fe294","decision_utc":"2026-08-01T02:05:00Z","implementation_version":"v8_prospective","map_hashes":{"additive_f32le_sha256":"0c0ee6a78b5ceda885751bd4f0947614aa1e13005449008902da3837cae49100","le3_f32le_sha256":"381b0b92f469034beccbce0b3b1ec8f318ba9efdb2dceeb7af88d92d8f01612c","roles":{"H":"b7bf0cca7a493156dc8753c9c3bfd2d5c091f7c967a6e04956da368411849219","P":"d1f99aee531cd3bccb4ccdad079948776da5e69050033bc263131ab5acc539e8","S":"d60c9b7d46d03019e785c13e8c154485918c8c033106f6b398365d2802b259b3","T":"1150f7e7fa5413e1b8bb742346dd05383ed4f02ce7cb37580054679747b98bbb"}},"preflight_manifest_sha256":"bd93adf8496f89af22febc7a76abd8957c59251d259be4cad3012ab1f4d50c1b","prompt_hashes":{"A":"cecb3555daa7a4cc0840db154086138dae9260795bde2b64e89f6724d80abb9b","B":"9521bee7fe7a6964d4ff61605bbe5a02eb4cfd149fd5aa9cbf975accbfe40314","combined":"a42268e4c0d1afb2b9576dd968d7f6250fc989fe3b97077a55363e63e1e2bb8a","system":"1ffc06755b18f9315dc930aaf02a0c79cf1f9e2d91d0ec5bae2fa0c1436ed048"},"reviewed_payload_sha256":"335a7cb5f90eaab429297774d751dc76e50f2e6415a8cfca90606babe0f2c2a7","reviewer":"independent_payload_reviewer_opus;fresh_context;zero_exposure_to_code_resource_review;single_round;verdict=GO_0C_0H_5I;review=refine-logs/C04_A0T_SMALL_V1_V8_PAYLOAD_REVIEW.md;review_sha256=e086859d3586e4d078cc1f8f9b807a2f7e24da3aa384d311023e374765e9e0a7;request_sha256=<see_record>;recomputed=414_staged_hashes,3200_pngs,400_video_sha256_3.43GB,selection_both_datasets,prompt_hashes_via_ast,role_maps_and_jl_payloads_byte_identical,400_item_geometry_both_processor_paths,projection_and_refit_of_the_v7_basis,800_renderings_against_402_banned_tokens;informationals=I1_partial_tranche_yields_no_verdict,I2_seal_reserve_unmeasured,I3_mhc_zh_transcript_poverty_24of200_under_10_scalars,I4_hate_video_95_all_black,I5_audit_ledger_prints_resolved_relative_in_clear","run_id":"C04-A0T-SMALL-v1","schema_version":"c04_payload_review_v8","staged_output_hashes":{"artifacts/c04/a0t_small_v1_impl_v8/checkpoints/frames/HateMM/hate_video_103/manifest.json":"e627ec080405282e0615816d302a6840c4362ee12757efdf3e9585ec5b622639","artifacts/c04/a0t_small_v1_impl_v8/checkpoints/frames/HateMM/hate_video_106/manifest.json":"5f406c85f9a129e1a7f153ed58877e5f985f5f1e419f55cbd370c975b161a130","artifacts/c04/a0t_small_v1_impl_v8/checkpoints/frames/HateMM/hate_video_119/manifest.json":"5c33ec99dc7bf1ef34d99df1fbdb93230a3d04a410e9934eec692ff4e0e1861c","artifacts/c04/a0t_small_v1_impl_v8/checkpoints/frames/HateMM/hate_video_121/manifest.json":"7d1723f5d41e22f84aa56f58d24dc53f7ac231b50a9fcf85f3027e67117bd53c","artifacts/c04/a0t_small_v1_impl_v8/checkpoints/frames/HateMM/hate_video_127/manifest.json":"b3fa36e9d39938ff591d799d19ef1494b7af49ab1e0ab9533b90505e9ba1b1c5","artifacts/c04/a0t_small_v1_impl_v8/checkpoints/frames/HateMM/hate_video_13/manifest.json":"6746c08bb3272c7c6c17d3ceb775f70b2da24063dee5f37923046ec1e95f75e8","artifacts/c04/a0t_small_v1_impl_v8/checkpoints/frames/HateMM/hate_video_133/manifest.json":"1d9c850145a4287ea89f20cde6cfaf8445b74f59b65950befa6136eb9072ec4d","artifacts/c04/a0t_small_v1_impl_v8/checkpoints/frames/HateMM/hate_video_137/manifest.json":"d5e79e54562b1a60fcca53fc50aa9ec3bd5ad5d238af46107c2f786c6985bf58","artifacts/c04/a0t_small_v1_impl_v8/checkpoints/frames/HateMM/hate_video_164/manifest.json":"229ed8ef3512ee2e16b82659cf73dbc490c6fa36e3cfc73e7265e25ba0429d88","artifacts/c04/a0t_small_v1_impl_v8/checkpoints/frames/HateMM/hate_video_175/manifest.json":"dd3b56b81d3b6a398ee2df8001a401426dc38fb0c31cd27322ba66b237925cf8","artifacts/c04/a0t_small_v1_impl_v8/checkpoints/frames/HateMM/hate_video_183/manifest.json":"6c0297383a36e3cf3b0d8a1cb259692f4387e47034bbe9b54975817c7e3cbec1","artifacts/c04/a0t_small_v1_impl_v8/checkpoints/frames/HateMM/hate_video_185/manifest.json":"a5b238153638a38053de019cd495e318b39b8c38e8f8a0244cc8c195ecf3cb9d","artifacts/c04/a0t_small_v1_impl_v8/checkpoints/frames/HateMM/hate_video_194/manifest.json":"bf9ed0a9c2784c89db5700715e5224262521b93c06526cbb1039063be4387163","artifacts/c04/a0t_small_v1_impl_v8/checkpoints/frames/HateMM/hate_video_199/manifest.json":"023ef630375bb8e5b75622098ca02a1e228473ed9cc5163ffbae05ce6136714e","artifacts/c04/a0t_small_v1_impl_v8/checkpoints/frames/HateMM/hate_video_203/manifest.json":"20840d096793c14276946c5a25d795793f78d175e69faa939d2b508af8a3dd88","artifacts/c04/a0t_small_v1_impl_v8/checkpoints/frames/HateMM/hate_video_216/manifest.json":"f280e8e79c9cafebae7d26bd826f76f94335a837f4e0b0c63588d5f72337e167","artifacts/c04/a0t_small_v1_impl_v8/checkpoints/frames/HateMM/hate_video_217/manifest.json":"075edc48421d25d5aad96fc42be5e01d4b6a094d4a5ebe47785b4c8d0c83c330","artifacts/c04/a0t_small_v1_impl_v8/checkpoints/frames/HateMM/hate_video_219/manifest.json":"117f107b143ce83b1534cfc4ca7b0949158b86c7376349a18e77eda13cbc8727","artifacts/c04/a0t_small_v1_impl_v8/checkpoints/frames/HateMM/hate_video_224/manifest.json":"ffc3c95731b515d0523492937f9ce438acb81a717f55b880559348ca02d11dd6","artifacts/c04/a0t_small_v1_impl_v8/checkpoints/frames/HateMM/hate_video_225/manifest.json":"ba5ebba3fd9c22c11f23770339d16edff3b71fa0ccbcc54a23e03ec8f29d9e40","artifacts/c04/a0t_small_v1_impl_v8/checkpoints/frames/HateMM/hate_video_227/manifest.json":"9f7b1c333eacd65fa9d0ac334d4365c58714b74e9ec13adc8c4e6277444ab69d","artifacts/c04/a0t_small_v1_impl_v8/checkpoints/frames/HateMM/hate_video_235/manifest.json":"34b5719f298800a82a605b3b3976d36e37e4288f4ce42ac631a9b9de1ca2b5e8","artifacts/c04/a0t_small_v1_impl_v8/checkpoints/frames/HateMM/hate_video_237/manifest.json":"fbf282ca6ccd6ed701822d2e84a91e246d1c8c429d0286733d239e9439c2c06b","artifacts/c04/a0t_small_v1_impl_v8/checkpoints/frames/HateMM/hate_video_238/manifest.json":"e5dc7f64afc8e01ce64cf55f264b3b68cf18ead0fcb27cff6ece08e3e32aa96a","artifacts/c04/a0t_small_v1_impl_v8/checkpoints/frames/HateMM/hate_video_242/manifest.json":"810546539b3f70521a358f11042f4c1f31f8f8c45290dfb6551ab4c54048cbd3","artifacts/c04/a0t_small_v1_impl_v8/checkpoints/frames/HateMM/hate_video_252/manifest.json":"d44bb44f8ac2e346d940be794f37a811640b686fdf8f231fa6e49689007b476e","artifacts/c04/a0t_small_v1_impl_v8/checkpoints/frames/HateMM/hate_video_253/manifest.json":"bc5415889f2773e86b1347025efcac5ce6be10cd8cafa208ddc6c2ab997adf3b","artifacts/c04/a0t_small_v1_impl_v8/checkpoints/frames/HateMM/hate_video_254/manifest.json":"c1399509e93eeb0dd8e6a973f460dfac91ff5dcdb8295211c787d8476bd34040","artifacts/c04/a0t_small_v1_impl_v8/checkpoints/frames/HateMM/hate_video_256/manifest.json":"a729391469a72332a470fe2f47da27e3ece64a9aa193a9f40f57f64d13f20392","artifacts/c04/a0t_small_v1_impl_v8/checkpoints/frames/HateMM/hate_video_266/manifest.json":"ae160ae69f5d7a2ef5bf2300b264ee79a8156bd4e5808f6f006311e9e07ece9f","artifacts/c04/a0t_small_v1_impl_v8/checkpoints/frames/HateMM/hate_video_272/manifest.json":"738e399d6ea15495272a91ed2b28ec6329242676b2870a5083ec2f8281821ec9","artifacts/c04/a0t_small_v1_impl_v8/checkpoints/frames/HateMM/hate_video_280/manifest.json":"4fa335db1539ca1a57c864cdb1bf8d16e70954a983d1a2354eee662ede5e3166","artifacts/c04/a0t_small_v1_impl_v8/checkpoints/frames/HateMM/hate_video_285/manifest.json":"1edc1c265fb51b2965deaf938adad193d6694dec0995c9dd8cc2800acc163e2a","artifacts/c04/a0t_small_v1_impl_v8/checkpoints/frames/HateMM/hate_video_288/manifest.json":"75c8a3e424cb1f4d5ea6c95cb66eba1e0fe3f51a384f9e8f97b8d901938be721","artifacts/c04/a0t_small_v1_impl_v8/checkpoints/frames/HateMM/hate_video_297/manifest.json":"cab7c59bdc18aa516c5936e68d6906f30a614a9c31eb0b5ce9407ae312764646","artifacts/c04/a0t_small_v1_impl_v8/checkpoints/frames/HateMM/hate_video_302/manifest.json":"0499d5c551eac5727b14827533fe1903b09a7b1001cf3b2ae42d1e32db8fe8d8","artifacts/c04/a0t_small_v1_impl_v8/checkpoints/frames/HateMM/hate_video_307/manifest.json":"901e6206bbfe9bf16582eda795098320b3483c304cd35f859cffd6e0dc90ba5b","artifacts/c04/a0t_small_v1_impl_v8/checkpoints/frames/HateMM/hate_video_313/manifest.json":"d628e103246b135949b79e2e930ed86ebff0f0d1c8321b962ea95f5d97f96448","artifacts/c04/a0t_small_v1_impl_v8/checkpoints/frames/HateMM/hate_video_315/manifest.json":"dc0e049888513b62038c2447e4b026d217ef58e1d3e9ee76963b012a1a31bd4c","artifacts/c04/a0t_small_v1_impl_v8/checkpoints/frames/HateMM/hate_video_316/manifest.json":"6b229faf805a75bc01d676b010c0563b0454a49e6f83b1b2376ede1cdce06985","artifacts/c04/a0t_small_v1_impl_v8/checkpoints/frames/HateMM/hate_video_319/manifest.json":"b77f01de8788483900974668c39a752484b0f00585d6988cabfa1b7694d9e4b8","artifacts/c04/a0t_small_v1_impl_v8/checkpoints/frames/HateMM/hate_video_323/manifest.json":"084aff1b788c1137705204cf1f35876c25aa06fd8bda1b624c0e87858de1b9cd","artifacts/c04/a0t_small_v1_impl_v8/checkpoints/frames/HateMM/hate_video_324/manifest.json":"351cd622c9ae5a2d9f5452a806f3d2ddb64eebaa6f6bfa0c403fa9c84aed0715","artifacts/c04/a0t_small_v1_impl_v8/checkpoints/frames/HateMM/hate_video_326/manifest.json":"c6cefb2e0e9f21091e7c88cfbe1409e2a1a039fc1cbbf314618b862b424a112c","artifacts/c04/a0t_small_v1_impl_v8/checkpoints/frames/HateMM/hate_video_334/manifest.json":"9fd7893930ce548574e6231aec2d5228cdbe339ece468ae67447435bbf9a9f3b","artifacts/c04/a0t_small_v1_impl_v8/checkpoints/frames/HateMM/hate_video_336/manifest.json":"a632f2ebe4c0863f725066ba050f19463439d70935ba7274ac42630e02b23dac","artifacts/c04/a0t_small_v1_impl_v8/checkpoints/frames/HateMM/hate_video_338/manifest.json":"04909b253306e98dc97c678acd65488f39250c13eacb1b366c2fe91d14efcf12","artifacts/c04/a0t_small_v1_impl_v8/checkpoints/frames/HateMM/hate_video_339/manifest.json":"0e2f17f9947645fcb23fe3055a8bb7b4518e5a140714b110d414b61b27c22284","artifacts/c04/a0t_small_v1_impl_v8/checkpoints/frames/HateMM